{
  "$schema": "./public-source-audit-schema.json",
  "audit_version": 1,
  "reviewed_on": "2026-08-21",
  "method": "Pinned public sources were reviewed as capability and risk inventories. All public workflows were independently authored from primary documentation and general engineering practice. No upstream text, structure, implementation, scripts, agents, hooks, templates, dependencies, model rosters, or examples were copied.",
  "summary": {"sources": 2, "skill_directories": 80, "bundle_components": 12, "total_components": 92},
  "sources": [
    {
      "source_url": "https://github.com/mattpocock/skills",
      "repository_url": "https://github.com/mattpocock/skills",
      "branch": "main",
      "pinned_revision": "5b15a47f2d7150f545fbcacbfe381787fc0230dc",
      "license": "MIT",
      "license_scope": "Repository-level MIT license at the pinned revision.",
      "reviewed_on": "2026-08-21",
      "content_reviewed": true,
      "text_copied": false,
      "structure_copied": false,
      "implementation_reused": false,
      "components": [
        {"path":"skills/engineering/ask-matt","component_class":"skill","disposition":"rejected","public_mapping":[],"rationale":"Source-specific router is not a portable capability.","security_notes":"Would add routing coupling and discovery pressure."},
        {"path":"skills/engineering/code-review","component_class":"skill","disposition":"covered","public_mapping":["code-change-review"],"rationale":"v0.6 supplies an independently authored, read-only, evidence-bounded change review.","security_notes":"The clean-room version stays read-only and evidence-bounded."},
        {"path":"skills/engineering/codebase-design","component_class":"skill","disposition":"covered","public_mapping":["module-interface-design"],"rationale":"v0.6 supplies an independently authored module and interface design workflow.","security_notes":"No upstream templates or prescriptive architecture rules are reused."},
        {"path":"skills/engineering/diagnosing-bugs","component_class":"skill","disposition":"covered","public_mapping":["systematic-diagnosis"],"rationale":"The catalog already provides causal diagnosis with an implementation boundary.","security_notes":"No diagnostic scripts or automatic network activity were imported."},
        {"path":"skills/engineering/domain-modeling","component_class":"skill","disposition":"covered","public_mapping":["domain-vocabulary-modeling"],"rationale":"v0.5 supplies an independently authored vocabulary and authority workflow.","security_notes":"No source formats, examples, or repository conventions were copied."},
        {"path":"skills/engineering/grill-with-docs","component_class":"skill","disposition":"partial","public_mapping":["alignment-interview","decision-governance-records"],"rationale":"Alignment and decision records cover the portable outcomes without the source-specific questioning structure.","security_notes":"The public workflow asks one material question at a time and stops when decision-ready."},
        {"path":"skills/engineering/implement","component_class":"skill","disposition":"covered","public_mapping":["plan-execution","test-driven-change"],"rationale":"Approved-plan execution and test-first change are already separate catalog capabilities.","security_notes":"Implementation never implies publication, merge, or delegation authority."},
        {"path":"skills/engineering/improve-codebase-architecture","component_class":"skill","disposition":"covered","public_mapping":["module-interface-design","change-impact-analysis"],"rationale":"v0.5 impact analysis and v0.6 module design cover the portable review outcomes without a bundled report generator.","security_notes":"No whole-repository automatic report generator is bundled."},
        {"path":"skills/engineering/prototype","component_class":"skill","disposition":"covered","public_mapping":["prototype-spike"],"rationale":"v0.6 supplies an independently authored bounded learning spike.","security_notes":"The clean-room version does not default to no tests, commit, merge, or production promotion."},
        {"path":"skills/engineering/research","component_class":"skill","disposition":"covered","public_mapping":["source-grounded-research"],"rationale":"Primary-source research and provenance are already covered.","security_notes":"Network access remains host-controlled and results preserve uncertainty."},
        {"path":"skills/engineering/resolving-merge-conflicts","component_class":"skill","disposition":"covered","public_mapping":["merge-conflict-reconciliation"],"rationale":"v0.6 supplies an operation-aware conflict workflow with an explicit abort and action gates.","security_notes":"The clean-room version permits abort and requires authority for stage, continue, commit, and push."},
        {"path":"skills/engineering/setup-matt-pocock-skills","component_class":"skill","disposition":"rejected","public_mapping":[],"rationale":"Repository-specific bootstrap and tracker conventions are not portable.","security_notes":"No automatic repository setup or identity configuration is imported."},
        {"path":"skills/engineering/tdd","component_class":"skill","disposition":"covered","public_mapping":["test-driven-change","test-strategy"],"rationale":"Test-first work and risk-based test selection are already covered.","security_notes":"The catalog preserves an explicit exception path when test-first is unsuitable."},
        {"path":"skills/engineering/to-spec","component_class":"skill","disposition":"covered","public_mapping":["implementation-planning","requirements-synthesis"],"rationale":"Traceable requirements and decision-complete plans cover specification synthesis.","security_notes":"No source document format is copied."},
        {"path":"skills/engineering/to-tickets","component_class":"skill","disposition":"covered","public_mapping":["implementation-planning"],"rationale":"v0.6 adds focused work-package guidance to implementation planning without issue-tracker mutation.","security_notes":"No issue-tracker mutation or fixed state machine is implied."},
        {"path":"skills/engineering/triage","component_class":"skill","disposition":"rejected","public_mapping":[],"rationale":"The reviewed state machine is source-specific and no portable need is demonstrated.","security_notes":"No automatic issue or pull-request mutation is imported."},
        {"path":"skills/engineering/wayfinder","component_class":"skill","disposition":"covered","public_mapping":["implementation-planning","decision-evidence-trace"],"rationale":"v0.6 adds focused decision-map guidance while the evidence trace preserves bounded public reasons.","security_notes":"No default subagents, branches, or tracker writes are adopted."},
        {"path":"skills/engineering/wizard","component_class":"skill","disposition":"covered","public_mapping":["guided-configuration"],"rationale":"v0.6 supplies independently authored human-guided configuration with protected action boundaries.","security_notes":"The clean-room workflow stops before privileged actions and avoids generated shell templates."},
        {"path":"skills/in-progress/claude-handoff","component_class":"skill","disposition":"covered","public_mapping":["task-handoff"],"rationale":"v0.6 supplies a client-neutral evidence-bounded handoff.","security_notes":"No client-specific session command is imported."},
        {"path":"skills/in-progress/implement-spec","component_class":"skill","disposition":"covered","public_mapping":["plan-execution","multi-agent-orchestration","implementation-planning"],"rationale":"Approved execution, bounded delegation, and v0.6 work packages cover the portable outcomes.","security_notes":"No maximum-concurrency, automatic merger, or cleanup behavior is adopted."},
        {"path":"skills/in-progress/loop-me","component_class":"skill","disposition":"rejected","public_mapping":[],"rationale":"Unbounded autonomous looping is outside the catalog safety model.","security_notes":"Automatic retries and persistence without a risk-based stop are rejected."},
        {"path":"skills/in-progress/setup-ts-deep-modules","component_class":"skill","disposition":"rejected","public_mapping":[],"rationale":"Source-specific TypeScript setup is narrower than the portable profile and module-design candidate.","security_notes":"No dependency, configuration, or generated file is imported."},
        {"path":"skills/in-progress/writing-beats","component_class":"skill","disposition":"partial","public_mapping":["high-signal-technical-writing"],"rationale":"The portable writing workflow covers structure and rhythm without copying a source style system.","security_notes":"Style guidance does not claim authorship detection."},
        {"path":"skills/in-progress/writing-fragments","component_class":"skill","disposition":"partial","public_mapping":["high-signal-technical-writing"],"rationale":"The portable writing workflow covers sentence fragments only when they improve the named voice.","security_notes":"No fixed voice or always-on style behavior is adopted."},
        {"path":"skills/in-progress/writing-shape","component_class":"skill","disposition":"partial","public_mapping":["high-signal-technical-writing"],"rationale":"The portable writing workflow covers document shape through audience and decision needs.","security_notes":"No source templates or examples are reused."},
        {"path":"skills/misc/git-guardrails-claude-code","component_class":"skill","disposition":"rejected","public_mapping":[],"rationale":"v0.5 remains instruction-and-reference-only and does not ship hooks.","security_notes":"Lifecycle hooks and command interception require a separate security and product decision."},
        {"path":"skills/misc/migrate-to-shoehorn","component_class":"skill","disposition":"rejected","public_mapping":[],"rationale":"Tool-specific migration has no demonstrated portable need.","security_notes":"No vendor package or migration command is imported."},